{
  "schema_version": 1,
  "timeout_ms": 1000,
  "concurrency": 1,
  "events": [
    {
      "id": "created",
      "payload": {
        "type": "order.created",
        "order_id": "example-1"
      }
    }
  ],
  "deliveries": [
    {
      "event": "created",
      "at_ms": 0
    },
    {
      "event": "created",
      "at_ms": 20
    }
  ]
}
